{
  "event_count": 1,
  "events": [
    {
      "actor": "compliance-officer",
      "argument_hash": "b81819a1936ad035f097473bcb31d78f89ed74b38ff8a5afbdc82117bf830753",
      "decision": "allow",
      "decision_request_hash": "8e6c230b0ad0e0b63f7614dbff52e63aab36a710c11f481d6b61cb13a810ab4f",
      "event_hash": "fc957b9782b6056b9af2baaeb9054a69d80327c45cdd5efc81b5beb35e777ea5",
      "event_id": "ev_7d241528aa27483e",
      "goal": "write compliance report",
      "matched_rules": [],
      "path": [
        "public_report.txt"
      ],
      "policy_version": "ruleset/compliance-ruleset/v1/be02ba386af91111",
      "previous_hash": "0000000000000000000000000000000000000000000000000000000000000000",
      "reason": "no rules matched",
      "state_hash": null,
      "timestamp_iso": "2026-06-18T13:51:38.946454+00:00",
      "tool": "runtime.file.write",
      "transformed_args": null
    }
  ],
  "genesis_hash": "0000000000000000000000000000000000000000000000000000000000000000",
  "last_hash": "fc957b9782b6056b9af2baaeb9054a69d80327c45cdd5efc81b5beb35e777ea5",
  "schema_version": "acgs/proof-pack/v1.1"
}
