{
  "event_count": 2,
  "events": [
    {
      "actor": "compliance-officer",
      "argument_hash": "dbe9c046099f8329cee928296db6c1cef9771ac8db773a6c4dd206c01b90fd56",
      "decision": "allow",
      "decision_request_hash": "c45ec855380924f908fdcc84173f1eb0923129654b3ec54b2c5bcf18b0e71974",
      "event_hash": "f3260c70dfb9402b402950db41adbe0895b36bfd085d73a2e5aba128dc6ca430",
      "event_id": "ev_91173c10c1094a6c",
      "goal": "g-1",
      "matched_rules": [],
      "path": [
        "public_report.txt"
      ],
      "policy_version": "ruleset/compliance-ruleset/v1/be02ba386af91111",
      "previous_hash": "0000000000000000000000000000000000000000000000000000000000000000",
      "reason": "no rules matched",
      "state_hash": null,
      "timestamp_iso": "2026-06-18T13:51:38.951933+00:00",
      "tool": "runtime.file.write",
      "transformed_args": null
    },
    {
      "actor": "compliance-officer",
      "argument_hash": "e2668bfdb207108718d36dcb5b199fa50d747868604582390aa26db4e5633ca7",
      "decision": "allow",
      "decision_request_hash": "cbefde33f2747668bc37d796b1a39c39b4a35ba829c052fc7c441a732a03d481",
      "event_hash": "f60fc833e4e04366f8f1532942add50682ec7da2b597a8f7d1c51e960d2c3959",
      "event_id": "ev_705da4fb57d5430d",
      "goal": "g-2",
      "matched_rules": [],
      "path": [
        "notes.txt"
      ],
      "policy_version": "ruleset/compliance-ruleset/v1/be02ba386af91111",
      "previous_hash": "f3260c70dfb9402b402950db41adbe0895b36bfd085d73a2e5aba128dc6ca430",
      "reason": "no rules matched",
      "state_hash": null,
      "timestamp_iso": "2026-06-18T13:51:38.961247+00:00",
      "tool": "runtime.file.write",
      "transformed_args": null
    }
  ],
  "genesis_hash": "0000000000000000000000000000000000000000000000000000000000000000",
  "last_hash": "f60fc833e4e04366f8f1532942add50682ec7da2b597a8f7d1c51e960d2c3959",
  "schema_version": "acgs/proof-pack/v1.1"
}
